claim_id,claim,level,evidence,boundary
C1,"`P_theta(L|x)` is a well-defined CRF posterior event probability for finite `Y,T` and regular language `L`",Main,`docs/audits/THEORY_AND_GUARDRAILS.md`; posterior algebra tests,requires finite sequence length and finite label set
C2,"Product automaton transfer computes `Z_{theta,L}(x)` exactly",Main,"product transfer tests match brute force for accept-all, empty, exact-pattern, parity, low-probability events",reference implementation is finite/sanity scale
C3,Hard-constrained decoding and posterior consistency are different objects,Main,R5a: constrained legality can be 1 while B0 `P(BIO|x)=0.0566`; B1 does not alter posterior mass,do not say hard constraints are useless
C4,Semi-event training can raise posterior event mass,Main-with-boundary,"R5a, R1, R2, R4 all show positive B4 event-mass movement",not always task-metric dominant; not benchmark superiority
C5,WNUT17 exposes hidden posterior BIO conflict under diagnostic stress,Main-with-boundary,R5a B0 hidden conflict near 1 with entity F1 0; B4 raises BIO event mass,diagnostic stress only; no NER usefulness claim
C6,WNUT17 is learnable by the local CRF setup,Main-with-boundary,R5b B0 entity F1 `0.1660` over 10 seeds,modest F1; no B4 NER improvement claim
C7,Low `P_theta(L|x)` is a field-style risk signal,Main-with-boundary,"R6a bottom/top gaps plus reanalysis: AUROC `0.7088`, AUPRC `0.8470`, risk-decile error falls from `0.8862` to `0.2624`",field-style tasks only; not calibration or all structured prediction
C8,Hidden conflict concentrates at low event mass in semi-real diagnostics,Main-with-boundary,R6a hidden-conflict gaps strongest on amount/date/product_code; R5a supports WNUT hidden conflict,real-source fields mostly saturated
C9,Reference product-transfer scaling can be discussed via product-state count,Main-with-boundary,"R8 varies sequence length, label count, DFA states, context order",reference CPU sanity only; no speed superiority
